{
  "schema": "euclid-min-geometry-gadget-library/v1",
  "source": {
    "certificate": "construction-69e.json",
    "certificate_sha256": "9b47738d955099547e15369f35cde40fa52c8c5d7594294d372f1ad753c6b10b",
    "construction_sha256": "6c4b0113fae6ab513d3a1564a268415fa1dd96952e14753201880b776f6fe3d3",
    "geometry_algebra_ir": "geometry-algebra-baseline-69e.json",
    "geometry_algebra_ir_sha256": "10bd1078cca58e4de894d8476101e252289b8f0220e141cd16e81008e56ed655"
  },
  "semantics": {
    "gadget": "named_geometry_program_with_explicit_state_boundary",
    "cost": "distinct_new_drawables_after_exact_execution_in_input_state",
    "free_effect": "all_finite_real_intersections_added_after_each_paid_draw",
    "scope": "verified_baseline_prefix_context_not_context_free_fixed_price"
  },
  "gadgets": [
    {
      "id": "gadget.low-tail-9e",
      "status": "verified_in_baseline_prefix_state",
      "source_macro": "macro.low-tail",
      "context": {
        "before_e_move": 46,
        "after_e_move": 55,
        "state_policy": "all_prefix_traces_persist"
      },
      "algebraic_interface": {
        "input_symbols": [
          "work.da",
          "work.dc",
          "period.d0"
        ],
        "output_symbols": [
          "period.e0",
          "period.e16",
          "work.e-low-0",
          "work.e-low-1",
          "period.f0",
          "period.f32"
        ],
        "input_representations": [
          "repr.D0",
          "repr.Da",
          "repr.Dc"
        ],
        "output_representations": [
          "repr.E0",
          "repr.F0",
          "repr.K2",
          "repr.auto.period.e16",
          "repr.auto.period.f32",
          "repr.auto.work.e-low-1"
        ]
      },
      "geometric_interface": {
        "required_points": [
          "B",
          "D0",
          "G",
          "Da",
          "D",
          "Dc",
          "A",
          "E"
        ],
        "required_drawables": [
          "b",
          "c",
          "a"
        ]
      },
      "program": [
        {
          "id": "BD0",
          "op": "line",
          "through": [
            "B",
            "D0"
          ]
        },
        {
          "id": "Y1",
          "op": "intersect",
          "objects": [
            "BD0",
            "b"
          ],
          "index": 0
        },
        {
          "id": "GDa",
          "op": "line",
          "through": [
            "G",
            "Da"
          ]
        },
        {
          "id": "Z1",
          "op": "intersect",
          "objects": [
            "GDa",
            "c"
          ],
          "index": 0
        },
        {
          "id": "DZ1",
          "op": "line",
          "through": [
            "D",
            "Z1"
          ]
        },
        {
          "id": "H2",
          "op": "intersect",
          "objects": [
            "DZ1",
            "a"
          ],
          "index": 0
        },
        {
          "id": "H2Y1",
          "op": "line",
          "through": [
            "H2",
            "Y1"
          ]
        },
        {
          "id": "E0",
          "op": "intersect",
          "objects": [
            "H2Y1",
            "c"
          ],
          "index": 0
        },
        {
          "id": "BE0",
          "op": "line",
          "through": [
            "B",
            "E0"
          ]
        },
        {
          "id": "I2",
          "op": "intersect",
          "objects": [
            "BE0",
            "b"
          ],
          "index": 0
        },
        {
          "id": "DcD0",
          "op": "line",
          "through": [
            "Dc",
            "D0"
          ]
        },
        {
          "id": "J2",
          "op": "intersect",
          "objects": [
            "DcD0",
            "b"
          ],
          "index": 0
        },
        {
          "id": "AJ2",
          "op": "line",
          "through": [
            "A",
            "J2"
          ]
        },
        {
          "id": "K2",
          "op": "intersect",
          "objects": [
            "AJ2",
            "c"
          ],
          "index": 1
        },
        {
          "id": "EK2",
          "op": "line",
          "through": [
            "E",
            "K2"
          ]
        },
        {
          "id": "L2",
          "op": "intersect",
          "objects": [
            "EK2",
            "a"
          ],
          "index": 0
        },
        {
          "id": "L2I2",
          "op": "line",
          "through": [
            "L2",
            "I2"
          ]
        },
        {
          "id": "F0",
          "op": "intersect",
          "objects": [
            "L2I2",
            "c"
          ],
          "index": 0
        }
      ],
      "effects": {
        "new_paid_drawables": [
          "BD0",
          "GDa",
          "DZ1",
          "H2Y1",
          "BE0",
          "DcD0",
          "AJ2",
          "EK2",
          "L2I2"
        ],
        "explicit_points_bound": [
          "Y1",
          "Z1",
          "H2",
          "E0",
          "I2",
          "J2",
          "K2",
          "L2",
          "F0"
        ],
        "full_free_closure_delta": {
          "point_count": 435,
          "point_ids": [
            "U0046",
            "Y1",
            "U0145",
            "U0193",
            "U0244",
            "U0292",
            "U0347",
            "U0398",
            "U0526",
            "U0572",
            "U0617",
            "U0658",
            "U0705",
            "U0748",
            "U0788",
            "U0832",
            "U0873",
            "U0913",
            "U0954",
            "U0993",
            "U1028",
            "U1064",
            "U1100",
            "U1135",
            "U1198",
            "U1254",
            "U1285",
            "U1313",
            "U1339",
            "U1366",
            "U1393",
            "U1418",
            "U1442",
            "U1464",
            "U1485",
            "U1507",
            "U2040",
            "U2041",
            "U2042",
            "U2043",
            "U2044",
            "U0012",
            "U0047",
            "U0146",
            "U0194",
            "U0245",
            "U0293",
            "U0348",
            "U0399",
            "U0445",
            "U0487",
            "U0527",
            "U0573",
            "U0618",
            "U0659",
            "U0706",
            "U0749",
            "U0789",
            "U0833",
            "U0874",
            "U0914",
            "U0955",
            "U0994",
            "U1029",
            "U1065",
            "U1101",
            "U1136",
            "U1169",
            "U1229",
            "U1255",
            "U1286",
            "U1314",
            "U1340",
            "U1367",
            "U1394",
            "U1419",
            "U1443",
            "U1465",
            "U1486",
            "U1508",
            "U1526",
            "U1544",
            "Z1",
            "U2047",
            "U2048",
            "U2049",
            "U2050",
            "U2051",
            "H2",
            "U0088",
            "U0108",
            "U0195",
            "U0294",
            "U0349",
            "U0400",
            "U0446",
            "U0488",
            "U0528",
            "U0574",
            "U0619",
            "U0660",
            "U0707",
            "U0750",
            "U0790",
            "U0834",
            "U0875",
            "U0915",
            "U0956",
            "U0995",
            "U1030",
            "U1066",
            "U1102",
            "U1137",
            "U1170",
            "U1199",
            "U1230",
            "U1256",
            "U1287",
            "U1315",
            "U1341",
            "U1368",
            "U1395",
            "U1420",
            "U1444",
            "U1466",
            "U1487",
            "U1509",
            "U1527",
            "U1545",
            "U2054",
            "U2055",
            "U2056",
            "U2057",
            "U2058",
            "U2059",
            "U0048",
            "U0089",
            "U0147",
            "U0196",
            "U0246",
            "U0295",
            "U0350",
            "U0401",
            "U0447",
            "U0489",
            "U0529",
            "U0575",
            "U0620",
            "U0661",
            "U0708",
            "U0751",
            "U0791",
            "U0835",
            "U0876",
            "U0916",
            "U0957",
            "U0996",
            "U1031",
            "U1067",
            "U1103",
            "U1138",
            "U1171",
            "U1200",
            "U1231",
            "U1257",
            "U1288",
            "U1316",
            "U1342",
            "U1369",
            "U1396",
            "U1421",
            "U1445",
            "U1467",
            "U1488",
            "U1510",
            "U1528",
            "U1558",
            "E0",
            "U2062",
            "U2063",
            "U2064",
            "U2065",
            "U2066",
            "U2067",
            "U2068",
            "U0049",
            "I2",
            "U0148",
            "U0197",
            "U0247",
            "U0296",
            "U0351",
            "U0402",
            "U0530",
            "U0576",
            "U0621",
            "U0662",
            "U0709",
            "U0752",
            "U0792",
            "U0836",
            "U0877",
            "U0917",
            "U0958",
            "U0997",
            "U1032",
            "U1068",
            "U1104",
            "U1139",
            "U1201",
            "U1258",
            "U1289",
            "U1317",
            "U1343",
            "U1370",
            "U1397",
            "U1422",
            "U1446",
            "U1468",
            "U1489",
            "U1511",
            "U1529",
            "U1559",
            "U1576",
            "U2071",
            "U2072",